{
  "schema_version": "0.1.0",
  "id": "REV-m1review002",
  "task_id": "RELAY-1001",
  "reviewer": {
    "id": "human:auditor",
    "type": "human",
    "role": "independent reviewer"
  },
  "created_at": "2026-07-19T01:12:00Z",
  "evidence_ids": ["EVD-m1remedied01"],
  "independent": true,
  "independence_notes": "The reviewer did not produce the remediated evidence.",
  "outcome": "pass",
  "findings": [
    {
      "severity": "info",
      "category": "acceptance-criteria",
      "summary": "The remediated artifact satisfies both declared criteria.",
      "evidence_uri": "artifacts/remediated-result.txt"
    }
  ],
  "ai_disclosure": {
    "used": false,
    "systems": [],
    "scope": "No AI system was used for this synthetic review record."
  }
}
