{
  "schema_version": "0.1.0",
  "id": "REV-m1review001",
  "task_id": "RELAY-1001",
  "reviewer": {
    "id": "human:auditor",
    "type": "human",
    "role": "independent reviewer"
  },
  "created_at": "2026-07-19T01:07:00Z",
  "evidence_ids": ["EVD-m1initial01"],
  "independent": true,
  "independence_notes": "The reviewer did not produce the submitted evidence.",
  "outcome": "remediation",
  "findings": [
    {
      "severity": "moderate",
      "category": "acceptance-criteria",
      "summary": "The initial artifact omits the required constraint check.",
      "evidence_uri": "artifacts/initial-result.txt"
    }
  ],
  "ai_disclosure": {
    "used": false,
    "systems": [],
    "scope": "No AI system was used for this synthetic review record."
  }
}
